{
  "$schema": "https://id.schemas.pub/o/DTI/PDPArchive/folder",
  "name": "AVClub",
  "allowed_keywords": ["$forwarded", "$MDNSent", "$ismailinglist"],
  "last_uid": 21,
  "highest_modseq": 6371845,
  "recent_uid": 20,
  "uidvalidity": 1107190787,
  "is_subscribed": true,
  "special_use": "\\Sent",
  "sort_order": 1,
  "myrights": "rwiptsldaex",
  "removed": ["3", "15"],

  "items": [
    {
      "uid": "1",
      "filename": "msg-1.eml",
      "flags": ["$seen", "$answered"]   
    },
    {
      "uid": "17",
      "filename": "msg-17.eml",
      "flags": ["$seen", "$answered", "$forwarded"]   
    },
    {
      "uid": "19",
      "filename": "msg-19.eml",
      "flags": ["$seen"]   
    },
    {
      "uid": "20",
      "filename": "msg-20.eml"
    },
    {
      "uid": "21",
      "filename": "msg-21.eml"
    }
  ]

}